{
  "brand": "FANN FASHION",
  "context_version": "1.2.0",
  "source": "github",
  "loaded_sections": [
    "identity.md",
    "voice-and-copy.md",
    "visual-system.md",
    "experience.md",
    "website.md",
    "philosophy.md",
    "decisions.md"
  ],
  "locked": {
    "identity": [
      "FANN FASHION is a men's fashion brand within the NSQ.global portfolio, entering through premium underwear.",
      "Its core experience combines confidence, comfort and personal identity.",
      "The approved brand promise is: Designed for Confidence. Engineered for Comfort.",
      "The approved tagline is: Support in Style.",
      "The current collection architecture is Silver Line, Gold Line, Platinum Line, Black Line and Legacy Line, with Seasonal Editions reserved for the next image batch.",
      "The current launch and website exclude X Edition and erotic-themed underwear.",
      "Warrior Line is a historical source name; use Legacy Line in current product, collection and website naming.",
      "The user-supplied FANN_Logo-2.png is the approved mark for initial use; retain Bank Gothic and Montserrat as the typography pairing.",
      "Approved display lockup: **FANN FASHION** on one line, with **Support in Style.** beneath; retain the supplied triangular logo alongside the wordmark where appropriate."
    ],
    "voice": [
      "Brand promise: Designed for Confidence. Engineered for Comfort.",
      "Tagline: Support in Style.",
      "Both approved lines belong in the brand system; neither replaces the other.",
      "Preserve the order: confidence is designed for; comfort is engineered for.",
      "Voice is bold, direct and confident without aggression or crude expression.",
      "Use concise, photography-led copy; avoid unsupported performance claims and generic luxury superlatives.",
      "Do not use erotic-themed positioning for the current launch or website."
    ],
    "visual": [
      "Display and wordmark typography: Bank Gothic.",
      "Body and user-interface typography: Montserrat.",
      "Primary background: Pure Near-Black #1C1C1C.",
      "Surface: #232323.",
      "Primary accent: Champagne Gold #B29C7D.",
      "Structural accent: Indigo Smoke #3A3F5C.",
      "Light neutral and headline colour: Off-White #E8E6E0.",
      "The current website must contain no erotic-themed imagery.",
      "Use a subtle gradient in the approved brand palette; preserve a calm text field and readable contrast.",
      "The company name and segment share one line, with the slogan beneath.",
      "Keep existing approved typefaces and marks. Source SVGs and PNGs retain platform-specific export dimensions.",
      "Current pack: company OneDrive → 00 - Company HQ → __NSQ Global Brand Identity → 06 - Social Profiles - Drafts."
    ]
  },
  "principles": [
    "Confidence begins within. The first layer should reinforce composure and a sense of self, whether or not anyone else sees it.",
    "Comfort is a design requirement. Visual impact must be reconciled with fit, movement, seam feel and sustained wear through physical development.",
    "Form should have purpose. Proportion, panel lines, texture and details should work together rather than accumulate decoration.",
    "Identity is personal. Different collections offer different degrees of expression within a coherent FANN design language.",
    "Strength is self-directed. Legacy explores discipline, honour, resilience, vision, courage and responsibility through narrative and form.",
    "Refined expression is deliberate. Confidence does not depend on shock, aggression, or conspicuous branding.",
    "Product truth matters. Describe development intentions as intentions; publish material and performance claims only when substantiated."
  ],
  "experience": [
    "Governing outcome: a visitor understands FANN's relationship between confidence, comfort and personal expression, then finds the collection that fits their character.",
    "Proposed journey: brand promise → collection choice → design intent → garment preview → fit and evidence when available → appropriate next action.",
    "Proposed governing visual idea: precise garment structure emerging from quiet space, with warm accents used sparingly.",
    "Proposed core/statement hierarchy: introduce Silver, Gold and Platinum as everyday expressions; give Black and Legacy distinct editorial moments without making the everyday products depend on mythology.",
    "Proposed Legacy interpretation: chosen personal values, expressed with refinement rather than costume, aggression or eroticism.",
    "Proposed mobile behavior: clear text and image hierarchy, short readable sections and deliberate collection navigation.",
    "Proposed motion: restrained transitions that preserve a complete static and reduced-motion experience.",
    "Current invitation: explore the concepts; activate signup only when consent text, privacy information and delivery have been configured."
  ],
  "website": [
    "Governing identity: Bank Gothic, Montserrat and the supplied geometric FANN mark.",
    "Exact promise: Designed for Confidence. Engineered for Comfort.",
    "Exact tagline: Support in Style.",
    "Platform: native Shopify. The connected development store is 8gdtem-bi.myshopify.com, initially named My Store 5, with Horizon installed as the MAIN theme.",
    "Content phase: prepare the catalogue, collection architecture, editorial copy and navigation now; choose website concept direction next; build the editable theme skeleton after that.",
    "All product images supplied on 29 September are concept renders, not final garment photography or proof of manufacture.",
    "Catalogue structure: Silver, Gold and Platinum have colour variants; the four Black designs and six supplied Legacy archetypes are separate products.",
    "Gold has six provisional colour directions. Only Maroon has an individual garment render; the other five are represented by the palette board.",
    "Seasonal Editions is reserved and unpublished pending the next source batch.",
    "X Edition is excluded from current products, pages, imagery and navigation.",
    "Draft products and unpublished editorial content do not authorize checkout, preorders, publishing or a production launch.",
    "All customer-facing headings, body text, images, links, spacing and colour controls must be editable through native Shopify theme settings, sections and blocks."
  ],
  "constraints": [
    "Preserve the exact promise, tagline, fonts and current X Edition exclusion from 28 September.",
    "Extend the draft catalogue to Silver, Gold, Platinum, Black and Legacy using the supplied references; reserve Seasonal Editions for the next batch.",
    "Keep the source's Warrior archetypes under the current Legacy Line name.",
    "Gold has six colours; the image board supplies provisional Black, Ivory, Purple, Blue, Maroon and Green directions. Names and shades remain open.",
    "Treat all underwear images as concept renders and every garment as still in development.",
    "Use the supplied FANN logo for initial implementation.",
    "Use native Shopify sections, blocks and JSON templates so Kay can edit small content and visual details.",
    "Create draft products and unpublished collection/page content without inventing retail prices, size ranges, stock, product claims or sales policies.",
    "Approved display typography: Bank Gothic.",
    "Approved body/UI typography: Montserrat.",
    "Approved brand promise, exact wording: Designed for Confidence. Engineered for Comfort.",
    "Approved tagline, retained alongside the promise: Support in Style.",
    "Exclude X Edition and erotic-themed underwear from the current launch and website. Any later reintroduction requires a new founder decision.",
    "Use the dedicated repository for the consolidated brand and future website work.",
    "ANURA master: **A World of Wellbeing**.",
    "ANURA Home: **The Essence of Wellbeing**.",
    "ANURA Residences: **The Architecture of Wellbeing**.",
    "ANURA Hospitality: **The Experience of Wellbeing**.",
    "Spell Wellbeing as one word throughout the identity.",
    "Place ANURA and its segment on one line, with the relevant slogan below.",
    "Use restrained background gradients drawn from each company's existing approved colours across the current eight-brand header/banner pack.",
    "FANN display lockup: **FANN FASHION**, with **Support in Style.** beneath it.",
    "Preserve brand-specific fonts and approved source marks. This is an identity/profile-asset revision, not authorization to create social accounts, invite followers or announce a launch."
  ],
  "open_questions": [
    "OPEN QUESTION: Final launch market, language, currency and release sequence.",
    "OPEN QUESTION: The suggested Arabic art association remains unconfirmed; do not invent an origin story.",
    "OPEN QUESTION: Hero supporting copy and the final invitation depend on the launch product and website mode.",
    "OPEN QUESTION: Vector master, final full/short wordmark lockups and clear-space rules.",
    "OPEN QUESTION: Final campaign casting, consistent garment photography/renders and production asset review.",
    "OPEN QUESTION: Selection of the website visual concept.",
    "OPEN QUESTION: Whether the public first release is a showcase, waitlist, preorder or stocked store.",
    "OPEN QUESTION: Website concept selection and final homepage composition.",
    "OPEN QUESTION: Final sizes, materials, supported benefits, prices, availability, delivery, returns and support operations.",
    "OPEN QUESTION: Production font rights, refined assets and final wordmark lockup.",
    "OPEN QUESTION: Final garment materials, construction, fit, sample testing and performance evidence."
  ]
}
